{
  "type": "rite",
  "id": "rite.blessing",
  "name": "Blessing",
  "school": "school.divine",
  "tags": [
    "element.faith"
  ],
  "resolution": "authored_lookup",
  "fixed_liturgy": true,
  "runtime_combination_allowed": false,
  "allows_hammer_symbol": true,
  "cost": {
    "resource": "resource.piety",
    "amount": 1
  },
  "effect_summary": "Kalev petitions a short grace that strengthens his next blows. Recasting replaces the blessing instead of stacking it.",
  "effect": {
    "delivery": {
      "kind": "self"
    },
    "modifier": {
      "kind": "damage_bonus",
      "modifier_id": "modifier.blessing",
      "amount": 0.25,
      "duration_sec": 6.0,
      "stacking": "replace"
    }
  },
  "confidence": "invented",
  "canon_status": "draft",
  "approval": {
    "status": "draft",
    "reviewer": "P7-010 fixture"
  },
  "source_notes": [
    {
      "confidence": "invented",
      "summary": "Starter rite stub from the active dual-school magic contract; it is authored gameplay, not attested historical liturgy.",
      "citations": [
        "docs/SYSTEMS/MAGIC.md"
      ]
    }
  ]
}
