{
  "type": "magic_grant",
  "id": "magic.grant.starter_spark",
  "name": "Teach Spark",
  "operation": "grant",
  "target_id": "spell.pagan.spark",
  "grant_flag": "flag.magic.taught_spark",
  "resolution": "authored_lookup",
  "runtime_combination_allowed": false,
  "confidence": "invented",
  "canon_status": "draft",
  "approval": {
    "status": "draft",
    "reviewer": "P7-010 fixture"
  },
  "source_notes": [
    {
      "confidence": "invented",
      "summary": "Explicit authored grant operation for the starter spell.",
      "citations": [
        "docs/SYSTEMS/MAGIC.md"
      ]
    }
  ]
}
